faltou relator corrigir texto pois acata emenda deputado sanderson elaboração texto coloca texto não condiz texto emenda 14 deputado sanderson precisa correção	train
defesa cidadão bem especialmente zona rfural	train
necessário cidadão direito legítima defesa	train
números acidente arma fogo aumentará devido flexibilização comercio facilitação compra	train
estatuto desarmamento art 6º inciso ix concede porte armas integrantes entidades desporto legalmente constituídas cac faltando apenas regulamentação	train
profissionais d segurança ñ deveriam ter q enfrentar burocracia nenhuma pra comprar armas	train
direito defesa constitucional qualquer democracia	train
facilita acesso armas civis aumentando risco mortes acidentais	train
favorecimento caça consequente empobrecimento biodiversidade ameaça sistemas naturais fundamentais renovação recursos primários qualquer produção	train
acesso armas legais direito inalienável cidadão cumpridor deveres leis precisamos critérios objetivos não podemos concordar termos direito tutelado vontade delegado polícia federal	train
aumentar segurança jurídica regular lei aspectos hoje regulados decretos portarias	train
direito garantido lei todo cidadão bem direito defender sentir seguro	train
direito defender	train
muitas emendas lógica desqualificam pl	train
não	train
proibir porte não diminuiu indice nenhum	train
direito garantido constituição além grande enorme maioria brasileiros serem contra desarmamento 66 população	train
direito legítima defesa constitucional	train
direito legitima defesa direito inalienável efeito preciso ter acesso meios necessários eficazes armas fogo	train
cidadão poderá proteger	train
cidadão vai poder andar certo	train
anseio pessoas bem	train
dá direito defesa cidadão bem não quiser não adquirir	train
crime cercear direito defesa cidadão bem pois assalta mata não porte não arma registrada	train
não vai liberando armas vamos diminuir violência contrário iremos	train
muita enrolação votada	train
cidadão precisa amparado ter direito legítima defesa garantido	train
grande demora aprovação lei	train
permite cidadão bem escolher quer não arma fogo	train
povo direito livre escolha armar cassado não pode considerado povo livre não concorda não compra direito quero ter	train
caçadores atiradores esportivos colecionadores manuseiam armas diariamente segurança direito porte	train
revolver ja tornou obsoleto eventual troca tiro bandidos portam pistolas kit rajada fuzis menos liberem pistola gc carregador reserva todos vigilantes trabalham armados	train
texto reconhece direito legítima defesa ainda limite categorias profissionais acesso porte armas	train
deireito escolha quer nao comprar arma tbem legitma defesa vida patrimonio	train
garantir todo cidadão reputação ilibada possa usar liberdade escolher deseja arma fogo defesa família	train
legitima defesa direito cidadão bem	train
cidadão bem direito defender	train
direito defesa diante más intensões	train
direito defesa pessoal patrimônio direito natural humano	train
direito legítima defesa direito fundamental qualquer cidadão bem tirar direito entra governo totalitário acesso armas garante esquecer porte armas vigilantes cacs	train
direito defender defender família bens	train
concordo plenamente pl menos cacs marginalizados leis praticam esportes renderam medalhas olímpicas brasil não podem ter porte armas afim poder defender evitar armas caiam mãos erradas	train
direito legitima defesa referendo 2005 ignorado porte cacs encontrem dentro lei vigente	train
deixando informar porte deve 10 anos deixando informar porte deve nome titular validade qualquer arma curta acervo	train
deixaram desse projeto advogado juiz promotor direito portar arma vivem dentro gabinetes não hierarquia atores jurídicos art 6º lei alto risco atividade advocatícia	train
direito defender defender família patrimônio	train
advocacia sempre atividade risco dado constantes atentados contra profissionais área	train
arma registrada via sinarm não poder portar arma trabalho casa casa trabalho pena reclusão alta chance pagar multa	train
proteja família bens vivendo ditadura medo reféns apoio 100 alguém medo armas fácil não compre	train
não faz sentido emp	train
relator pl deputado alexandre leite misturou assuntos proibido lei complementar famoso jabuti acrescentando pl posse porte armas artigos versam sobre caça animais silvestres	train
não papel cidadão preocupar arcar segurança pública além disso incluido pl liberação caça animais silvestres absurdo	train
aumentar pena porte ilegal arma fogo ainda cima direito fiança absurdo equiparando pena homicídio 6 10 anos chega lei desarmamentista podem menos ouvir voz povo	train
porte arma deve direito cidadao pronto	train
direito legítima defesa	train
direito defesa pessoal	train
direito legítima defesa	train
permanece categorização não sendo permitido porte todo cidadão cumprir requisitos	train
restabelece direito defesa vida através acesso armas	train
deveria deixar claro quanto cidadão ter direito porte	train
possibilidade defesa cidadão bem segurança jurídica atirador esportivo maior acesso armas haverá menor criminalidade	train
faltou inclusão porte armas praças forças armadas estabilidade	train
grande restrição relação porte arma	train
cidadão deve ter direito defender	train
possibilidade concreta cidadão proteger si família	train
plebiscito povo havia escolhido liberação armas deputados senadores contramão vontade popular época legislaram contra vontade popular	train
melhora acesso direito legítima defesa	train
ainda não cidadão bem precisa proteger família integridade melhor nada concordo totalmente	train
cidadão bem desvantagem contra criminosos	train
processo aquisição posse porte caros demanda tempo cumprimento série requisitos portanto decisão cidadão modo não pode imposição estado	train
cidadão direito defender proteger família patrimônio forma eficaz proporcional nível agressor bandidos todos armados estado não onipresente não pode proteger todos	train
ressaltamos pl deve legislar sobre objeto posse porte armas não sobre outras atividades caça cuja possível alteração legislação vigente deve discutida amplamente sociedade forma pública transparente	train
possibilidade porte cidadão comum demonstre necessidade fato atende vontade popular expressa referendo 2005	train
nenhum	train
liberdade responsabilidade	train
além direito defesa garantido constituição amenizada falta respeito cometida costas opinião publica diante referendo 2005 onde população não aceitou desarmamento assim feito apenas cidadãos bem claro	train
porte arma cacs	train
ponto negativo deputados federais senadores não respeitarem escolhido plebiscito	train
retorna cidadão bem direito proteção vida familiares terceiros principalmente àqueles exercem profissão risco advogados	train
estatuto desarmamento art 6º inciso ix concede porte armas integrantes entidades desporto legalmente constituídas cac faltando apenas regulamentação pl oportunamente vem sanar omissão administração	train
direito cidadão	train
segurança jurídica	train
porte vigilante	train
ainda constar exigência efetiva necessidade retirada porte arma necessidade defesa si	train
garantir direito cidadão possuir manter armas defender desburocratizar sistema direito fundamental cumprir referendo 2005	train
garantia defesa cidadão bem trabalha honra compromissos paga impostos deseja apenas respaldado prosseguir vida família	train
traz segurança jurídica cacs pessoas exercem atividade risco visto cacs posse porte trânsito grande familiaridade armas fogo	train
demorou respeitarem plebiscito 2005 país caos polícia não conta proteger cada individualmente direito auto defesa sagrado	train
defesa pessoal direito ninguém pode tomar arma pra cumprirem requisitos legais	train
mudanças leis sobre armamento continuam sendo restritivas	train
fundamental exercício livre arbítrio defender	train
direito cidadão bem respeito referendo 2005	train
faltou advogados projeto visto além tratar isonomia magistrados promotores advocacia conforme estatuto ordem tornado cada vez profissão onde risco perseguido sofrer atentado contra vida aumentado	train
referendo 2005 bem claro assim população enganada políticos desarmamentistas	train
inclusão agentes segurança socioeducativos pois correm auto risco devido função exercem	train
cacs necessitam desta lei melhor proteger acervos assim transportar tendo vista serem pessoas comprovadamente idôneas	train
direito cidadão bem defender família defender	train
estado não cumpre papel dar segurança cidadão	train
população brasileira não preparada liberação drogas armas	train
contempla meio legítima direito natural todos	train
porte funcional cac	train
não existente pontos negativos	train
termos defender tiraram cidadão direito defesa	train
garante respeita direito legítima defesa	train
interessa não saber onde vêm onde vão deveriam ir munições podem perguntar deputado alexandre leite aumento violência	train
armado mata morre desarmado morre	train
devolve direito cacs	train
não incluiu advogados	train
direito legitima defesa minimo cidadao precisa pl iremos evoluir	train
obediência constituição federal legítima defesa	train
minimiza risco cacs alvos bandidos	train
porte arma vigilantes categorias risco fato atividade ja direito porte serviço so irá estender	train
faltou incluir direito porte atiradores desportivos	train
direito legitima defesa	train
direito quer ter arma ter direito defesa	train
constitucional direito armar	train
não concordo exclusão possibilidade outras categorias previstas regulamento porte arma exclui executivo direito regulamentar profissões risco	train
garantia direito legítima defesa cidadão bem	train
possibilita direito todo cidadão atende pré requisitos adquirir arma fogo forma legal	train
regras claras tema reflete real opinião povo rejeitou lei desarmamento referendo	train
precisamos sim amparo pessoas bem direito proteção	train
todo cidadão direito legitima defesa	train
cidadão não anencefálico pecou cumpra lei senão estado escravize todos	train
direito constitucional defesa vida família patrimônio entendem não necessário simples não peçam posse porte importante assentar categorias direito constou decretos	train
faltou inclusão advogados	train
devemos respeitar plebiscito lei desarmamento onde previsto porte p atiradores fazendo valer previsto porque senão vez ficará evidenciado desrespeito lei ideologia alguns vez evidenciada	train
revoga lei avança pouco liberdade povo	train
cac concordo pl pois categoria porte federal enquadra efetiva necessidade além cacs todos brasileiros têm direito	train
todo cidadao bem deve ter direito defesa policia nao unipresente	train
avanço questão direito defesa parte cidadão pacifica questão porte arma atirador desportivo desfazendo insegurança gerada entendimento diverso lei agentes segurança	train
atende parte anseios povo	train
advogado não profissão risco conselheiro tutelar não função risco	train
garante cidadao bem direito defender si familia contra bandidos nao respeitam leis andam armados tratam população seres descartaveis	train
antes estatuto fez burocratizar compra cidadão bem bandidos ficaram mesma	train
arma não sinônimo segurança contrário vai facilitar uso armas fogo população civil vai acabar usando forma errada qualquer discussão	train
garante cidadãos bem direito defesa própria família patrimônio	train
enho direito defender defender família não policias pode defender momento precisamos	train
precisamos porte irmos local arcevo local treino ter correr risco sermos presos injustamente	train
ponto positivo pl ainda pouco branda caminho certo posse porte armas cidadão bem principalmente cacs necessitam porte proteger acervo	train
livre escolha cidadão ter não arma fogo	train
contra categorização porte enquanto umas classes direito porte outras precisam não principalmente cidadão preencha requisitos pra facilitar pra cac favor	train
capacidade reação direito legítima defesa frente injusta agressão assaltantes homicidas inescrupulosos porte armas garantido não respeitam lei	train
legítima defesa	train
deveria liberal irestrito	train
direito defesa cidadão bem fazer valer lei conforme escolha povo através plebiscito	train
amplia espaço propriedade rural bem razoável	train
direito cidadão bem poder necessário ter direito defesa vida familiares obrigação segurança dever estado	train
direito própria defesa	train
concede porte arma categorias necessitam devido periculosidade atividade exercem	train
brasil precisa voltar planeta terra alinhar países desenvolvidos civilizados onde posse porte arma dificultado não facilitado	train
equalização direitos governo não consegue garantir bandidos fiquem desarmados população direito proteger	train
decisão brasileiro favor armamento tomada plebiscito todo brasileiro deve ter direito portar arma logicamente responderá excesso cometidos defesa pessoal direito deve respeitado deve desarmado bandidos não cidadãos bem	train
direito inegável proteção bem precioso vida principalmente não segurança privada carro blindado	train
não vejo pontos negativos	train
proposta favorável somente banditismo péssimo população pois fragiliza ainda controle munições retirada numeração balas projeto criminoso	train
morosidade votação	train
governos redor mundo chacinaram 170 milhões próprios cidadãos durante século xx stalin hitler mao pol pot esmagadora maioria desses cidadãos havia sido desarmada mesmos governos antes serem assassinados	train
porte cacs 2 anos cr	train
levar arma cidade campo vice versa	train
direito defesa fala si não justiça nação permitir filhos exterminados elementos ruins não quiser não obrigado	train
quero defender vida família patrimônio infelizmente polícia não onipresente obrigação defender	train
clareza texto original reconhece direitos fundamentais permite acesso armas cidadão cumpre todos critérios definidos agora projeto lei senadores deputados pediam	train
ter direito legítima defesa	train
precisa dar direitos porte cidadão bem menas burocracia demora processos	train
devolve direito cidadão defender defender família	train
porque retiraram urgência desse pl povo morrendo chance legítima defesa	train
legitima atraves discussao legislativo estabelece maia solidez regramento proposto vista precariedade decreto direito posse todo cidadao qualificado porte algumas categorias criterios ainda rigidos	train
faltou fiscais auditores receitas estaduais justo princípio simetria especialmente fiscais estaduais pr ms mt ro trabalham rodovias infestadas contrabandistas traficantes	train
legitima defesa direito pessoal	train
defesa vida cidadao bem	train
difícil levar sério integrantes partido dem contudo ministro onix sendo dem avaliza	train
reforma falido estatuto desarmamento após 15 anos vigência mostrou serve apenas cercear direito cidadãos bem não inibe uso armas criminosos	train
respeita decisão referendo possibilita cidadão cumpridor leis possuir portar arma proteção pois estado não onipresente protegedor	train
concordo plenamente alterações apesar serem tímidas ainda mostra tendência mudança ideológica armas causa mortes armas mãos cidadãos bem protegem crime cometido armas ilegais estatuto nada ajudou	train
cac ainda sérias restrições dificuldades relação aquisição	train
dar direito cidadão bem legítima defesa	train
direito constitucional defesa vida pessoas bem vontade pessoas bem constatada plebicito legítima defesa direito cidadão	train
restrições deveria liberado tudo	train
abrirá mercado novas empresas aumentará arrecadação governo através tributos taxas	train
falta diminuir tempo porte cac retirar limitação armas munição	train
respeito referendo 2005	train
ainda não acolhe direito legitima defesa cidadãsos acolhido emenda garantir legitima defesa uso arma fogo quaisquer meio cf	train
não cita prazo validade porte não diz pessoal vinculado determinada arma	train
direito legal cidadão bem possuir portar arma legítima defesa basta absurdos jurídicos bandidos armados cidadãos desarmados	train
não inclui fiscais estaduais porte realizar sacrifício sanitário animais portadores doenças	train
nao abrangente suficiente deixado muitas brechas interpretacao juridica necessita maiores detalhes juridicos proteger cidadao bem	train
direito constitucional cidadão bem proteger vida familiares bem terceiros presença flagrante delito	train
todos têm direito constitucional ter legítima defesa assegurada estado não direito regular cidadão pode não ter âmbito legal	train
reconhecimento liberdade	train
mulher toda certeza quero direito defender todos contra direito buscando controle social população	train
garante direito deslocamento fos atletas tiro esportivo ma interpretação trajeto	train
cidadão ter direito armar defender	train
brasil sociedade engatinha necessita leis demais têm pouca fiscalização	train
direito defesa cidadão bem família falta investimentos segurança alta taxa criminalidade principalmente desejo maioria população brasileira acordo plebiscito 2005	train
direito defesa cidadão	train
não existem pontos negativos dar direito defesa cidadão caso não queira exercer direito não comprar nenhuma arma portar nenhuma arma	test
importante regulamentação clara respeite referendo 2005 posse porte exercício legitima defesa direito tirado covardemente cidadãos brasileiros	test
proteção á casa vida	test
liberdade direito legítima defesa cidadão bem desse país	test
infelizmente justiça espada caminham juntas	test
unico ponto negativo estatuto regente dias hoje priva cidadão exercer direito escolha	test
direito vida cidadão bem votação contra desarmamento 2005 onde direitos brasileiros tirados força pois vencemos contra desarmamento	test
auto defesa agente público	test
jeito muda todo dia não possivel apontar algo positivo	test
amplia capacidade defesa cidadão	test
flexibilização aquisição arma fogo máxima expressão liberdade meio garantia demais direitos constitucionalmente garantidos todos queiram	test
atirador desportivo precisa tratado respeito direito porte costa lei pois não aplicado	test
proposta fato facilitar acesso armas aumenta violência existem pesquisas confiáveis mostrando	test
consolidação direitos constitucionais definição propriedade defensável consolidação direito cacs quais não haveria cultura armamentista consolidação vontade popular referendada retificação aberrações jurídicas viés ideológico	test
faltou diversas categorias necessidade defender	test
direito cidadão não quiser não compre porém não opine direito quer comprar estatuto desarmamento serviu beneficiar bandidos	test
garante direito legítima defesa	test
possibilidade cidadão ordeiro poder diante tanta insegurança conseguir direito porte desde cumpra exigências determinada lei	test
defesa pois vigilante direto defesa trabalho risco vida não seguros governo não segurança	test
ampliar facilitar comercialização porte armas andar armado possuir armas não defende protege ninguém fato	test
direito defesa pessoal familiar	test
legitima defesa porte cacs	test
projeto não representa totalidade direitos propriedade armas fogo passo importante rumo liberdade acesso armas fogo cidadãos	test
garante direito proteção vida patrimônio cerceado forma disfarçada ridículo estatuto desarmamento	test
deve acrescentada categorias trazidas governo primeiro decreto transformar efetiva necessidade ato vinculado não discricionário	test
todos direito defesa	test
não porque armado protegido abordado surpresa dificilmente conseguirá reagir tempo	test
faltou acrescentar profissão vigilante	test
não limita aquisição muniçã não exige curso tiro não considera dolo disparo pontos vitais afinal atira defender assume risco assassinar alguém	test
libera armas cidadãos bem possibilitando controle armamento defesa pessoal	test
deveria especificar melhor sobre civil poder atirar clubes tiro necessitar tirar registro antecedência	test
devolve cidadão bem direito optar não ter portar arma fogo legitima defesa caso cumpra requisitos aprovado testes práticos psicológicos tal	test
dá efetividade decidido referendo 2005 respeito vontade popular	test
nenhum	test
faltou isonomia porte pessoal guardas civis municipais	test
todo cidadão direito legítima defesa	test
direito defesa vida familiares pena morte neste país existe cidadão bem morre mãos marginais protegidos leis falhas devolvam direito roubado referendo 2005 dá direito	test
relativa condição atender parte anseios população clama possibilidade escolha possuir portar arma respeitando direito defesa cidadão garantido constituição federal	test
atirador desportista preciso ter legítima defesa garantida assegurar acervo insegurança país grande precisamos proteção	test
necessário garantir direito transporte desmuniciado somente craf necessidade guias transito facilitaria treino arma manutneção periódica junto armeiros cadastrados evitando acidentes eventual necessidade utilização	test
ajuda restabelecer direito natural sagrado humano defender si próprio família patrimônio contra injustas ameaças	test
papel segurança pública andar armada não pode assunto deliberado presidente precisa amplo debate	test
garantia direito defesa	test
ha mudar lei desarmamento totalmente plebiscito 2005 não respeitado	test
clareza texto original reconhece direitos fundamentais permite acesso armas cidadão cumpre todos critérios definidos agora projeto lei senadores deputados pediam	test
todos	test
senhores deputados pl 3723 regulamenta situação muitas categorias utiliza pce contamos apoio vossa compreensão aguardamos votação hoje certeza lembraremos voto agradecemos	test
cidadão bem bons antecedentes maior acesso armas fogo defesa família património estatuto desarmamento não representa vontade povo brasileiro traídos imposição deste estatuto votação não ganhou	test
legitima defesa direito	test
estado não onipresente sendo impossível antecipação necessária dar proteção cidadão tendo direito posse arma alternativa viável inibir ação bandido	test
cac não deve ter pedágio ter porte	test
restaura direito cidadão cumpre requisitos lei portar armas fogo defesa	test
100 favor porte ea legítima defesa	test
liberdade individuo defender possuir portar armamento trazendo segurança própria população desarmada merce bandidagem diminuindo monopólio estatal armamento queremos liberdades povo direito defender	test
aumenta liberdade cidadão exercer direito nato legítima defesa armada	test
porte arma porte arma	test
permite revogação garantia tirada lei onde somente marginais podem andar armados dias atuais	test
vez aprovado pl 3723 processo registro junto pf vai demorado não condiz site diz prazo imediato após dar entrada documentação	test
protege profissionais exercício atividades podem resultar risco segurança vida	test
faltou incluir vigilantes direito porte	test
regulamentação pessoas capacitadas possam andar armadas crucial diminuição violência brasil pois bandidos sabem cidadãos bem desarmados facilitando	test
direito cidadão defender vida família propriedade	test
existe porte cac desde momento precisa ir casa pro clube clube pra casa pl não precisa aparecer aprovada pra criar dificuldades	test
direito legítima defesa porte posse cidadão bem favor pl	test
garante direito legitima defesa	test
cac esperamos direito legitima defesa agora negado famigerado estatuto desarmamento projeto corrige injustiças votação sendo adiada motivo	test
negativo è povo não poder ter direito á liberdade escolha principalmente direitos	test
estatuto desarmamento art 6º inciso xi concede porte armas agentes segurança tribunais pl vem sanar omissão administração não dar porte pessoal agente	test
estatuto desarmamento art 6º inciso ix concede porte armas integrantes entidades desporto legalmente constituídas cac faltando apenas regulamentação pl oportunamente vem sanar omissão administração	test
restrições concessão porte cacs	test
regulamentar previsto estatuto art 6º inciso ix porte cac s	test
quero direito defender familia	test
embora não exprima totalidade anseios povo geral razoável	test
redução vulnerabilidade domicílio perante criminosos invasores	test
concordo exigências objetivas tais aptidão técnica psicológica discordo exigência subjetiva vez efetiva necessidade imprevisível pode acontecer qualquer momento cidadão bem deve ter direito legal defender	test
não trata arma fogo sim legítima defesa direito tirado governo referendo 2005 não respeitado	test
quanto cac não precisaria 2 anos cr pegar porte cac cac tudo igual	test
altera lei retrocedendo retirando porte armas guardas municipais cidades abaixo 500 mil habitantes acontecer praticamente vai extinguir guardas	test
ponto destacaria nesse projeto todas categorias encontre artigo 144 fato direito porte arma serviço serviço tendo vista artigo 144 destaca área segurança pública	test
segurança jurídica desportista	test
porte cacs ter várias armas casa não poder andar nenhuma defender pior volta casa	test
garantia direito fundamentais legitima defesa	test
atirador desportista ainda assim difícil precisamos estender facilidade menos burocrática todos	test
votamos plebiscito rdes sociais quase maioria quer ter direito defender gostaria saber deputados senadores seguranças desarmados	test
população sempre escolheu	test
treinamento	test
cumpre parte direito defesa prole	test
