não concordo verbo proibir democracia libera regulamenta penas severas fizer errado 2003 liberado hoje apenas não segue lei pode anda amras	test
poderia conter lista profissões consideradas risco justifique necessidade porte armas jeito privilégio cacs cac defendo direito todos cidadãos	test
permite caça não especificando animal silvestre exótico inserção caça projeto não afeito tema discussão sociedade extremamente prejudicial país	test
estado não consegue manter segurança cidadão logo não pode cercear legitima defesa	test
direito legítima defesa	test
garante segurança familia	test
não enxergo ponto positivo nenhuma iniciativa facilite amplie comercialização uso armas	test
concordo tudo acho precisamos avançar vejo sempre muita vontade aumentar penas desgraçar vida atirador registrado flagrado 1 munição bolso pouco empenho agravar penas manter presos conseguem todo tipo armamento forma ilegal cometem terríveis crimes vemos tão frequentemente	test
minimo minimo doque deve mudado	test
regulamenta porte armas cacs vivem limbo juridico pois autorização segundo lei desarmamento infelizmente nunca ouve regulamentação cacs direitos não atendidos governantes	test
todos direito defender devem ter posse responsavel armas porte liberado todos	test
direito defesa deve garantia inalienável	test
pontos negativos	test
nenhum	test
faz cumprir artigo 6 inciso iv lei	test
não inclui porte funcional advogados membros magistratura membros ministério público	test
estabelece esclare lei posse porte armas cria criterios regulamentacoes respeita avontade maiori povo	test
direito cidadao bem lei desarmamento deu certeza bandido pai familia nao defender porque bandido nao la devolver arma porque lei fala nao pode ter	test
defesa pessoal família direito constitucional estado não capaz oferecer direito constituconal	test
cumprimento lei	val
únicos defensores própria vida mesmos força estado não pode todos lugares subsidiar segurança nada justo legítima defesa	val
porte deveria pra todos	val
liberação porte arma fogo defesa própria família bem inclui carros motos tirar dever estado promover segurança pública cidadão assegurar direito ir vir	val
direito defesa escolha cidadão estado não pode onipresente	val
começa devolver direito roubado cidadão após referendo 2005 mostrou verdadeira vontade maioria	val
maior controle sobre armas ilegal direito cidadão exercer cidadania acesso cidadão meios protegem direito legitima defesa vez todas dispositivo regula cacs	val
munições projeto não marcadas modo tornar público rastreável comprou utilizou	val
não	val
condão desburocratizar comércio arma fogo ajustar abertura mercado fatores efeitos positivos economia geração empregos industrialização nacional	val
corrigi pequena parte direito individual cidadão brasileiro poder defender	val
faltou constar cac poderá portar arma cadastrada acervo sigma não sinarm	val
roubaram povo referendo fazem vergonha aí dentro dão risadas cara população	val
defesa cidadão bem proteção proteção familia	val
direito defesa cidadão bem	val
alguns casos diferença vida morte endurecer lei fazer mau uso desse direito simples	val
segurança	val
faltando emenda incluir direito porte arma advogados	val
todos	val
deve facilitado aquisição armas pessoas preparo legitimidade usar arma fogo	val
não discricionariedade autoridade estatal definir concessão porte deveriam critérios objetivos	val
altera art 6º dando possibilidade presidente abrir porte arma fogo categorias tira subjetividade momento aquisição arma fogo cidadão	val
dá direito cidadão defender marginais	val
dessa forma cac maior flexibilidade prática tiro desportivo porte facilita locomoção	val
direito defesa inalienável	val
deve aprovado porte arma advogados profissão risco	val
desburocratiza fixa requisitos objetivos concessão compra porte não pode ato discricionário agente publico	val
liberação armas todos restrição calibre assim acabava ladrões bandidos querem fazer mal pessoas bem visse pessoas armadas medo	val
nenhum pais livre cidadãos não livres defenderem	val
atende parte anseios direito legitima defesa uso porte armas fogo	val
importantíssimo proteção própria vida equipamento deveria estendido todos cidadãos	val
preserva direito garante possa ter meios defender criminosos tiranos	val
inconstitucional deixar cidadão entregue própria sorte	val
burocracia ainda grande demorada demora aprovação esferas politicas	val
atiradores caçadores colecionadores nao poder defender arsenal presas fáceis	val
determinação algumas poucas classes	val
falta ainda rever sobre processo compra armamento	val
projeto totalmente desfigurado	val
acabar ideia cidadão precisa comprovar algo ter porte morar brasil demonstração efetiva necessidade	val
separa cacs tempo cr separação deveria mediante atestado capacidade tec não tempo cr pessoas 5 anos cr não deram disparos enquanto alguns dão disparos mes	val
permite àquele apto quiser possuir arma defesa tomar ação	val
faltou colocar claro vigilantes profissionais segurança correm risco todos dias trabalhão armados	val
garante exercício legítima defesa cidadão responsabilidade	val
direito legítima defesa respeitar vontade povo	val
apensado solução duradoura	val
bom dia cidadão dê bem pagador impostos governamentais diariamente pagador direito assegurar dar segurança tranquilidade família responsável quê pôr governo não têm capacidade	val
direito defesa	val
todo cidadão preencha requisitos deveria ter direito porte armas pois não trata capricho trata direito defesa tendo visto todos dias saímos casas ovelhas matadouro polícia nunca unipresente	val
acesso cidadão bem porte armas federal	val
tendo critérios mínimos expedição autorizações não vejo problema	val
direito cidadão bem poder defender família	val
direito defesa diminuição progressiva violência porque criminosos vão pensar duas vezes antes tentar assalto porque vitima pode armada reagir	val
não atende direito fundamental humando	val
defesa patrimônio imediato cidadão não tendo dependência ineficaz estado	val
liberdade direito defesa	val
liberdade individual escolha	val
porte arma agentes socioeducativos alvos constantes ameaças	val
não incluiu agentes trânsito poderiam colaborar ordem pública conforme determina parágrafo 10º art 144 constituição federal	val
porte arma civis	val
oficiais justiça devem ter direito porte arma pois trabalham vulneráveis cumprimento execução ordens judiciais anda nenhuma proteção estado lidando dia dia pessoas perigosas locais desertos	val
cria restrições porte atirador desportivo não existiam estatuto desarmamento	val
2003 liberado todo cidadão assim devia voltar severas penas agir errado cultura proibir invés regulamentar ficalizar punir assusta prática anti demorática perigosa	val
prazo	val
porte arma direito todo cidadão bem ponto final abraço deputado	val
direitos auto defesa cidadão bem familiares	val
não tratou porte funcional advogados antiga requisição classe junto casas legislativas	val
direito defesa cidadão	val
incluir direito porte arma advogado ainda atua processo criminal	val
pra mim segurança cidadão bem pois direito defesa deva inalienável	val
direito cidadão bem poder ter portar arma sinônimo liberdade governo medo cidadão bem armas não merece respeito povo	val
todos cidadão passagens deveriam ter direito posse porte	val
enquanto bandidos andando armados aí cidadão bem ter direito andar armado defender	val
vigilantes merecem ter porte menos defender vidas ir vir posto serviço	val
liberdade cada escolha quer ter arma nao	val
liberdade individual cada cidadão	val
arma guardada casa objeto uso	val
concordo porque além direito natural todo homem defender estado não consegue garantir proteção cidadão propriedade forma eficiente	val
estado não pode interferir direito	val
porte armas reside zona rural toda extensão propriedade registramento armas não registradas	val
defesa pessoal família	val
falta postura alguns legisladores tentam distorcer projeto emendas absurdas dificultando avanço proposta	val
justo direito defesa amparado lei	val
não sentido cac não ter porte utilizar arma defesa próprio equipamento arsenal	val
não atender vontade soberana	val
dar cidadão bem acesso legítima defesa	val
direito legítima defesa	val
não define claramente categorias direito porte arma	val
parte vai encontro vontade popular direito comprar possuir portar armas fogo conforme resultado referendo 2005	val
liberdade direito defesa	val
bom começo senhores parlamentares sentem ameaçados rapidamente solicitam seguranças armados ponto positovo ter possibilidade real quiser adquirir instrumento ótimo utilizar legítima defesa	val
porte trânsito craf ganho maravilhoso deveria estender porte totalidade	val
devolve cidadão comum não suficiente proteção estatal dignidade poder defender	val
garante direito cidadão poder defender sendo estado incapaz prover total segurança	val
faltou especificar porte arma abrangerá todas armas porte registradas nome detentor porte armas tanto sinarm sigma	val
extender porte advogados isonomia procuradores juizes magistrados não podemos elitizar porte armas concurso público	val
direito escolha	val
não incluiu advogados	val
faltou validade porte qualquer arma acervo sigma sinarm bem validade 10 anos conforme decreto 9785 revogado	val
projeto devolve cidadão bem direito legitima defesa bem maior vida	val
atiradores devem ter porte incondicionalmente	val
não podemos abrir mão desse tipo informação país onde cerca 43 mil pessoas mortas armas fogo anualmente onde índice elucidação homicídios baixíssimo	val
melhora pouco situação atual ainda não ideal melhor vir	val
direito garantido constituição nenhum governo deveria ir contra	val
país livre país armas população bem	val
direito defender defender família	val
direito ter segurança legítima defesa proteger família lar empresa	val
